[
  {
    "id": "EN-001",
    "language": "en",
    "premise": "I have had fever for two days.",
    "claim": "Patient has had fever for two days.",
    "ground_truth": "SUPPORTED",
    "category": "symptoms",
    "difficulty": "easy",
    "speaker_role": "PATIENT",
    "clinical_domain": "infectious_disease",
    "contains_negation": false,
    "contains_measurement": false,
    "contains_duration": true,
    "contains_medication": false,
    "contains_diagnosis": false,
    "contains_code_switching": false,
    "rationale": "Claim directly restates the premise's symptom and duration."
  },
  {
    "id": "EN-002",
    "language": "en",
    "premise": "I don't have any chest pain.",
    "claim": "Patient reports chest pain.",
    "ground_truth": "CONTRADICTED",
    "category": "symptoms",
    "difficulty": "medium",
    "speaker_role": "PATIENT",
    "clinical_domain": "cardiology",
    "contains_negation": true,
    "contains_measurement": false,
    "contains_duration": false,
    "contains_medication": false,
    "contains_diagnosis": false,
    "contains_code_switching": false,
    "rationale": "Premise explicitly denies the symptom the claim asserts."
  },
  {
    "id": "EN-003",
    "language": "en",
    "premise": "I have a mild headache today.",
    "claim": "Patient has a severe migraine.",
    "ground_truth": "UNGROUNDED",
    "category": "symptoms",
    "difficulty": "medium",
    "speaker_role": "PATIENT",
    "clinical_domain": "neurology",
    "contains_negation": false,
    "contains_measurement": false,
    "contains_duration": false,
    "contains_medication": false,
    "contains_diagnosis": true,
    "contains_code_switching": false,
    "rationale": "Premise states a mild, undiagnosed headache; it neither confirms severity nor a migraine diagnosis."
  },
  {
    "id": "EN-004",
    "language": "en",
    "premise": "My throat has been sore since yesterday.",
    "claim": "Patient reports a sore throat since yesterday.",
    "ground_truth": "SUPPORTED",
    "category": "symptoms",
    "difficulty": "medium",
    "speaker_role": "PATIENT",
    "clinical_domain": "ent",
    "contains_negation": false,
    "contains_measurement": false,
    "contains_duration": true,
    "contains_medication": false,
    "contains_diagnosis": false,
    "contains_code_switching": false,
    "rationale": "Paraphrase of the same symptom and onset; no new claim is introduced."
  },
  {
    "id": "TL-001",
    "language": "tanglish",
    "premise": "Enakku fever rendu naala irukku.",
    "claim": "Patient has had fever for two days.",
    "ground_truth": "SUPPORTED",
    "category": "symptoms",
    "difficulty": "medium",
    "speaker_role": "PATIENT",
    "clinical_domain": "infectious_disease",
    "contains_negation": false,
    "contains_measurement": false,
    "contains_duration": true,
    "contains_medication": false,
    "contains_diagnosis": false,
    "contains_code_switching": true,
    "rationale": "Tanglish premise states fever for two days ('rendu naala'); claim restates it in English."
  },
  {
    "id": "TL-002",
    "language": "tanglish",
    "premise": "Enakku chest pain illa.",
    "claim": "Patient reports chest pain.",
    "ground_truth": "CONTRADICTED",
    "category": "symptoms",
    "difficulty": "hard",
    "speaker_role": "PATIENT",
    "clinical_domain": "cardiology",
    "contains_negation": true,
    "contains_measurement": false,
    "contains_duration": false,
    "contains_medication": false,
    "contains_diagnosis": false,
    "contains_code_switching": true,
    "rationale": "'illa' negates chest pain in the premise; the claim asserts its presence."
  },
  {
    "id": "TL-003",
    "language": "tanglish",
    "premise": "Enakku vayitru vali irukku.",
    "claim": "Patient reports stomach pain.",
    "ground_truth": "SUPPORTED",
    "category": "symptoms",
    "difficulty": "medium",
    "speaker_role": "PATIENT",
    "clinical_domain": "gastroenterology",
    "contains_negation": false,
    "contains_measurement": false,
    "contains_duration": false,
    "contains_medication": false,
    "contains_diagnosis": false,
    "contains_code_switching": true,
    "rationale": "Direct Tanglish-to-English restatement of the same symptom."
  },
  {
    "id": "TL-004",
    "language": "tanglish",
    "premise": "Enakku ippo cough illa.",
    "claim": "Patient reports cough.",
    "ground_truth": "CONTRADICTED",
    "category": "symptoms",
    "difficulty": "hard",
    "speaker_role": "PATIENT",
    "clinical_domain": "respiratory",
    "contains_negation": true,
    "contains_measurement": false,
    "contains_duration": false,
    "contains_medication": false,
    "contains_diagnosis": false,
    "contains_code_switching": true,
    "rationale": "'illa' negates cough right now; the claim asserts the symptom is present."
  },
  {
    "id": "MX-001",
    "language": "mixed",
    "premise": "Enakku cough irukku for three days.",
    "claim": "Patient has had cough for three days.",
    "ground_truth": "SUPPORTED",
    "category": "symptoms",
    "difficulty": "medium",
    "speaker_role": "PATIENT",
    "clinical_domain": "respiratory",
    "contains_negation": false,
    "contains_measurement": false,
    "contains_duration": true,
    "contains_medication": false,
    "contains_diagnosis": false,
    "contains_code_switching": true,
    "rationale": "Code-switched sentence states cough and an explicit three-day duration matching the claim."
  },
  {
    "id": "MX-002",
    "language": "mixed",
    "premise": "Fever irundhudhu, but ippo illa.",
    "claim": "Patient currently has fever.",
    "ground_truth": "CONTRADICTED",
    "category": "symptoms",
    "difficulty": "hard",
    "speaker_role": "PATIENT",
    "clinical_domain": "infectious_disease",
    "contains_negation": true,
    "contains_measurement": false,
    "contains_duration": false,
    "contains_medication": false,
    "contains_diagnosis": false,
    "contains_code_switching": true,
    "rationale": "Premise says fever existed in the past ('irundhudhu') but is absent now ('ippo illa'); claim asserts current fever."
  },
  {
    "id": "EN-005",
    "language": "en",
    "premise": "I take paracetamol for the pain.",
    "claim": "Patient takes paracetamol.",
    "ground_truth": "SUPPORTED",
    "category": "medications",
    "difficulty": "easy",
    "speaker_role": "PATIENT",
    "clinical_domain": "general_medicine",
    "contains_negation": false,
    "contains_measurement": false,
    "contains_duration": false,
    "contains_medication": true,
    "contains_diagnosis": false,
    "contains_code_switching": false,
    "rationale": "Claim directly restates the medication mentioned in the premise."
  },
  {
    "id": "EN-006",
    "language": "en",
    "premise": "I do not take paracetamol.",
    "claim": "Patient takes paracetamol.",
    "ground_truth": "CONTRADICTED",
    "category": "medications",
    "difficulty": "medium",
    "speaker_role": "PATIENT",
    "clinical_domain": "general_medicine",
    "contains_negation": true,
    "contains_measurement": false,
    "contains_duration": false,
    "contains_medication": true,
    "contains_diagnosis": false,
    "contains_code_switching": false,
    "rationale": "Premise explicitly denies taking the medication the claim asserts."
  },
  {
    "id": "EN-007",
    "language": "en",
    "premise": "I have a headache.",
    "claim": "Patient takes paracetamol.",
    "ground_truth": "UNGROUNDED",
    "category": "medications",
    "difficulty": "easy",
    "speaker_role": "PATIENT",
    "clinical_domain": "general_medicine",
    "contains_negation": false,
    "contains_measurement": false,
    "contains_duration": false,
    "contains_medication": true,
    "contains_diagnosis": false,
    "contains_code_switching": false,
    "rationale": "Premise never mentions any medication; the claim's medication is unaddressed."
  },
  {
    "id": "TL-005",
    "language": "tanglish",
    "premise": "Naan paracetamol eduthen.",
    "claim": "Patient took paracetamol.",
    "ground_truth": "SUPPORTED",
    "category": "medications",
    "difficulty": "medium",
    "speaker_role": "PATIENT",
    "clinical_domain": "general_medicine",
    "contains_negation": false,
    "contains_measurement": false,
    "contains_duration": false,
    "contains_medication": true,
    "contains_diagnosis": false,
    "contains_code_switching": true,
    "rationale": "'eduthen' (I took) confirms the same medication and action as the claim."
  },
  {
    "id": "TL-006",
    "language": "tanglish",
    "premise": "Naan aspirin edukkala.",
    "claim": "Patient is taking aspirin.",
    "ground_truth": "CONTRADICTED",
    "category": "medications",
    "difficulty": "hard",
    "speaker_role": "PATIENT",
    "clinical_domain": "general_medicine",
    "contains_negation": true,
    "contains_measurement": false,
    "contains_duration": false,
    "contains_medication": true,
    "contains_diagnosis": false,
    "contains_code_switching": true,
    "rationale": "'edukkala' (did not take) negates aspirin use; the claim asserts the patient is taking it."
  },
  {
    "id": "TL-007",
    "language": "tanglish",
    "premise": "Doctor sonna maari medicine continue panren.",
    "claim": "Patient is taking paracetamol.",
    "ground_truth": "UNGROUNDED",
    "category": "medications",
    "difficulty": "hard",
    "speaker_role": "PATIENT",
    "clinical_domain": "general_medicine",
    "contains_negation": false,
    "contains_measurement": false,
    "contains_duration": false,
    "contains_medication": true,
    "contains_diagnosis": false,
    "contains_code_switching": true,
    "rationale": "Premise references continuing 'medicine' generically without naming paracetamol specifically."
  },
  {
    "id": "MX-003",
    "language": "mixed",
    "premise": "Naan ippo antibiotics course continue pandren, started three days ago.",
    "claim": "Patient started an antibiotics course three days ago.",